{
  "$schema": "https://json-schema.org/draft/2020-12/schema",
  "title": "The BOINC server's committed settings, contrib-compute/infra/boinc/env/<env>.json",
  "description": "Public settings that scripts/provision-boinc.sh deploys as the stack usnm-boinc-<env> into usnm-boinc-rg-<env>, and scripts/build-boinc-images.sh updates with the images it builds. Nothing secret belongs here: the secrets are made in Azure (contrib-compute/infra/boinc/modules/keyvault.bicep). Keys sorted. provision-boinc.sh checks the same rules with jq.",
  "type": "object",
  "additionalProperties": false,
  "required": ["assessment", "codeSignPublicKey", "goldBundle", "images", "location", "operator", "projectUrl", "subscriptionId"],
  "properties": {
    "$schema": {
      "type": "string",
      "description": "This schema, for editors: ./schema.json."
    },
    "assessment": {
      "type": "boolean",
      "description": "Run the server from the bridge image (the server image plus usnm-boinc), so the usnm_assess and usnm_gold validators can run: main.bicep's assessment parameter."
    },
    "codeSignPublicKey": {
      "type": "string",
      "description": "The PUBLIC half of the offline code-signing key (code_sign_public), as text. Empty until it is made on the offline machine. The private half never comes here or to Azure."
    },
    "goldBundle": {
      "type": "boolean",
      "description": "Deploy the gold bundle job, which builds the gold bundle v1 from its publishers onto the share inside the VNet (docs/boinc.md#build-the-gold-bundle): main.bicep's goldBundle parameter."
    },
    "images": {
      "type": "object",
      "additionalProperties": false,
      "required": ["appver", "bridge", "server", "worker"],
      "description": "Images by registry digest, or empty before the first build. server and bridge are in the app's shared registry (infra/names/<env>.json) and come from scripts/build-boinc-images.sh; with server empty, the stack deploys only the base resources. worker is the public GHCR package that volunteers pull (ADR-0019, addendum), from .github/workflows/boinc-worker.yml. appver is the last published app version (images/appver, usnm-boinc-appver), written by scripts/boinc-app-release.sh; when set, the stack keeps the publish job on it.",
      "properties": {
        "appver": { "type": "string", "pattern": "^$|^[a-z0-9.-]+\\.azurecr\\.io/usnm-boinc-appver@sha256:[0-9a-f]{64}$" },
        "bridge": { "type": "string", "pattern": "^$|^[a-z0-9.-]+\\.azurecr\\.io/[a-z0-9/_.-]+@sha256:[0-9a-f]{64}$" },
        "server": { "type": "string", "pattern": "^$|^[a-z0-9.-]+\\.azurecr\\.io/[a-z0-9/_.-]+@sha256:[0-9a-f]{64}$" },
        "worker": { "type": "string", "pattern": "^$|^ghcr\\.io/tgoodyear/usnm-boinc-worker@sha256:[0-9a-f]{64}$" }
      }
    },
    "location": {
      "type": "string",
      "pattern": "^[a-z0-9]+$",
      "description": "Azure region; the resource group's own."
    },
    "operator": {
      "type": "object",
      "additionalProperties": false,
      "required": ["login", "objectId"],
      "description": "The Entra user or group that gets Key Vault Secrets Officer, Log Analytics Reader on the stack workspace, and is named as the MySQL Entra administrator in the printed step.",
      "properties": {
        "login": { "type": "string", "minLength": 1 },
        "objectId": {
          "type": "string",
          "pattern": "^[0-9a-f]{8}-[0-9a-f]{4}-[0-9a-f]{4}-[0-9a-f]{4}-[0-9a-f]{12}$"
        }
      }
    },
    "projectUrl": {
      "type": "string",
      "enum": ["https://boinc.usnewsmap.com/", "https://boinc-dev.usnewsmap.com/"],
      "description": "The BOINC master URL. Permanent once volunteers attach."
    },
    "requireSecureTransport": {
      "type": "boolean",
      "default": false,
      "description": "Require verified MySQL TLS. Defaults OFF when absent. Set true only after #464 actual Azure-chain, complete copied-project migration/rollback and all-client acceptance, under #529 coordination. Forwarded by normal provisioning; no portal-only toggle."
    },
    "subscriptionId": {
      "type": "string",
      "pattern": "^[0-9a-f]{8}-[0-9a-f]{4}-[0-9a-f]{4}-[0-9a-f]{4}-[0-9a-f]{12}$"
    }
  }
}
