{
  "$schema": "./schema.json",
  "assessment": true,
  "codeSignPublicKey": "1024\ned41759f6f9d26afc59cb55b47403279aefb529ddf0c7a45dd05edd252b406cf\n90b71251e5e224a2df33de05941de47c966258a7a0042c1d276d999f1aaa8d79\n2894de320981f6bbf430b30a40987c37d647b029051abcf21f79da809f7f28a2\na8bb6d18af8eb4edca94c4413e5fb6b2fa7c4c6cd6ab4b205944d31babdd9739\n0000000000000000000000000000000000000000000000000000000000000000\n0000000000000000000000000000000000000000000000000000000000000000\n0000000000000000000000000000000000000000000000000000000000000000\n0000000000000000000000000000000000000000000000000000000000010001\n.\n",
  "goldBundle": true,
  "images": {
    "appver": "crusnmprodffapzy.azurecr.io/usnm-boinc-appver@sha256:ab3fdcbde983224afff0d4537609775381edb588a603a6b10a1c41d4dc045769",
    "bridge": "crusnmprodffapzy.azurecr.io/usnm-boinc-bridge@sha256:054b2a8397bed5fcab22c8014c7bdaef18e9efd1cafff64704013babbc895ff8",
    "server": "crusnmprodffapzy.azurecr.io/usnm-boinc-server@sha256:10e8ee12caf29bd30c43fadd94aed1b6ae9d89b7c1c3dd48c7faa7f09626c894",
    "worker": "ghcr.io/tgoodyear/usnm-boinc-worker@sha256:9c8eac0485d52e6f8f060f665371d60bf84356bc4b177f32f4aa3f5ccf9307b9"
  },
  "location": "westus2",
  "operator": {
    "login": "Trevor Goodyear",
    "objectId": "0b398b81-9e13-427f-9dc2-e38d890554bc"
  },
  "projectUrl": "https://boinc.usnewsmap.com/",
  "subscriptionId": "25bf257c-c94e-4d61-bba3-edc635f46602"
}
